"NAO OPTANTE PELO SIMPLES NACIONAL","MATERIAL DE CONSUMO","field2_name","field1_name","Escolha... ","field2_name","NaN/NaN/NaN","NaN/NaN/NaN","NaN/NaN/NaN","APROPRIACAO DE MATERIAL DE CONSUMO - MAT DE CONSUMO
NF DATA/NR: Escolha...  NaN/NaN/NaN
EMPRESA NAO OPTANTE PELO SIMPLES NACIONAL","DSP101","2024NE000","0","115610100","213110400","DSP101","field2_name","field2_name","field2_name","field2_name",",5,85","field2_name","field2_name","field2_name"
"NAO OPTANTE PELO SIMPLES NACIONAL","MATERIAL DE CONSUMO","field2_name","field1_name","Escolha... ","field2_name","NaN/NaN/NaN","NaN/NaN/NaN","NaN/NaN/NaN","APROPRIACAO DE MATERIAL DE CONSUMO - MAT DE CONSUMO
NF DATA/NR: Escolha...  NaN/NaN/NaN
EMPRESA NAO OPTANTE PELO SIMPLES NACIONAL","DSP101","2024NE000","0","115610100","213110400","DSP101","field2_name","field2_name","field2_name","field2_name","5,85","field2_name","field2_name","field2_name"
